{
  "unique_id": "digitaal-bericht-v2-voorbeeld",
  "title": "Dit bericht heeft acht jaar op je gewacht",
  "text": "Hé. Ik ben jij. Acht jaar later.\n\nDit bericht had je eerder moeten bereiken, maar er ging iets mis met de verbinding. Gelukkig is het nu toch aangekomen.\n\nIk heb je hulp nodig. Morgen moet ik iets opleveren waar ik trots op ben, maar mijn bestanden staan door elkaar en ik weet niet meer welke versie de juiste is.\n\nIk wou dat ik acht jaar geleden had geleerd hoe ik mijn digitale werk goed kon organiseren. Daarom begin ik bij jou.\n\nJe hoeft vandaag niet mijn hele probleem op te lossen. Begin klein: maak één duidelijke plek voor jouw werk. Ik stuur je de komende weken meer berichten.\n\nGroetjes,\nJij",
  "speed": 3,
  "mistakes": true,
  "mistake_rate": 0.035,
  "cursor": true
}
